commit	quality_score	status	dimension_scores	description
f87a968	8.470588	keep	s=9,c=8,a=8,e=9,n=8,d=8,t=9,g=9	baseline
010ee2a	8.411765	discard	s=9,c=8,a=8,e=9,n=7,d=8,t=9,g=9	add phase completion criteria (hurt conciseness)
8b4a01c	8.470588	discard	s=9,c=8,a=8,e=9,n=8,d=8,t=9,g=9	add specific tool usage to Phase 1 (no change)
3c39c49	8.411765	discard	s=9,c=8,a=8,e=9,n=7,d=8,t=9,g=9	add ambiguous/cross-cutting/external to triage (hurt conciseness)
bdced14	8.470588	discard	s=9,c=8,a=8,e=9,n=8,d=8,t=9,g=9	trim redundant guidelines (no change)
cafa8f2	8.470588	discard	s=9,c=8,a=8,e=9,n=8,d=8,t=9,g=9	add noun+verb decision rule for asking user (no change)
318d016	8.411765	discard	s=9,c=8,a=8,e=9,n=7,d=8,t=9,g=9	replace triage with decision table (hurt conciseness)
f6f48ef	8.470588	discard	s=9,c=8,a=8,e=9,n=8,d=8,t=9,g=9	trim filler phrases (no change)
e0234ad	8.470588	discard	s=9,c=8,a=8,e=9,n=8,d=8,t=9,g=9	add tool usage and reasoning to example (no change)
10d30d9	8.470588	discard	s=9,c=8,a=8,e=9,n=8,d=8,t=9,g=9	eliminate Guidelines section entirely (no change)
fad0516	8.411765	discard	s=9,c=8,a=8,e=9,n=7,d=8,t=9,g=9	compound rewrite: tools+decisions+ambiguous (hurt conciseness)
7e0a6e8	8.470588	discard	s=9,c=8,a=8,e=9,n=8,d=8,t=9,g=9	precision rewrite vague→specific phrases (no change)
4a403c5	8.470588	discard	s=9,c=8,a=8,e=9,n=8,d=8,t=9,g=9	remove inline task example (no change, shorter)
8dfa6b8	8.470588	discard	s=9,c=8,a=8,e=9,n=8,d=8,t=9,g=9	strengthen grounding novel-pattern fallback (no change)
e96d017	8.470588	keep	s=9,c=8,a=8,e=9,n=8,d=8,t=9,g=9	COMPLETE REWRITE: 22% shorter, tools+decisions+ambiguous (same score, simpler)
7ef768c	8.470588	discard	s=9,c=8,a=8,e=9,n=8,d=8,t=9,g=9	add small-feature example (no change)
9b743e9	8.470588	keep	s=9,c=8,a=8,e=9,n=8,d=8,t=9,g=9	ULTRA-CONDENSED: 120 lines (45% reduction from original, same score)
6d6a5b7	8.470588	discard	s=9,c=8,a=8,e=9,n=8,d=8,t=9,g=9	add cross-cutting/external/unfamiliar guidance (no change)
912c28b	8.470588	discard	s=9,c=8,a=8,e=9,n=8,d=8,t=9,g=9	add per-phase Produces output specs (no change)
5a4e186	8.470588	discard	s=9,c=8,a=8,e=9,n=8,d=8,t=9,g=9	reorder sections to match rubric order (no change)
fb8e3db	8.470588	discard	s=9,c=8,a=8,e=9,n=8,d=8,t=9,g=9	add workflow overview at top of Instructions (no change)
fcf62d6	8.470588	discard	s=9,c=8,a=8,e=9,n=8,d=8,t=9,g=9	phase output annotations + expanded example (no change)
9b743e9	8.235294	keep	s=9,c=8,a=8,e=8,n=8,d=8,t=9,g=8	SONNET BASELINE on ultra-condensed skill
5900810	8.352941	keep	s=9,c=8,a=8,e=9,n=8,d=8,t=9,g=8	strengthen grounding: exploration protocol + cite-file example (example 8→9)
b4da145	8.235294	discard	s=9,c=8,a=8,e=8,n=8,d=8,t=9,g=8	add inline cite example to Technical Decisions (example dropped)
dc99e1c	8.352941	discard	s=9,c=8,a=8,e=9,n=8,d=8,t=9,g=8	add adaptive phase depth guidance (no change)
987d372	8.235294	discard	s=9,c=8,a=8,e=8,n=8,d=8,t=9,g=8	expand grounding guideline (example dropped)
d66fa8b	8.235294	discard	s=9,c=8,a=8,e=8,n=8,d=8,t=9,g=8	add artifact names to phase headings (example dropped)
b65d511	8.352941	discard	s=9,c=8,a=8,e=9,n=8,d=8,t=9,g=8	add adaptive triage reasoning to example (no change)
ba03a28	8.235294	discard	s=9,c=8,a=8,e=8,n=8,d=8,t=9,g=8	replace guidelines with adaptability scenarios (example dropped)
7900dfe	8.352941	discard	s=9,c=8,a=8,e=9,n=8,d=8,t=9,g=8	enrich example explore with reasoning and line refs (no change)
a78a6cd	8.352941	keep	s=9,c=8,a=8,e=9,n=8,d=8,t=9,g=8	enrich example explore with agent reasoning and line refs (reliable e=9, true improvement)
a03f765	8.313725	discard	s=9,c=8,a=8,e=8.67,n=8,d=8,t=9,g=8	add completion criterion to Phase 0 (destabilized e, no clarity gain)
09dc410	8.352941	discard	s=9,c=8,a=8,e=9,n=8,d=8,t=9,g=8	add novel pattern to example PRD (no change)
2cc97ec	8.313725	discard	s=9,c=8,a=8,e=8.67,n=8,d=8,t=9,g=8	add completion criteria to Phase 0+3 (no clarity gain, e unstable)

# --- SCALE CHANGE: 1-10 → 1-50 below this line ---
a78a6cd	8.364706	keep	s=44,c=42,a=40,e=43,n=41,d=40,t=43,g=42	NEW BASELINE: 1-50 scale with Sonnet evaluator
5e9bcee	8.372549	discard	s=44,c=42,a=40.7,e=42.7,n=39.3,d=40,t=43,g=42	add output format specs (actionability +1 but conciseness -2, not Pareto)
efe1862	8.294118	discard	s=44,c=41,a=40,e=43,n=38,d=40,t=43,g=42	shorten step 4 + format spec (conciseness -3, clarity -1)
b941439	8.380392	keep	s=44,c=41.7,a=40.3,e=43,n=40.3,d=41,t=43,g=42	replace redundant spike guideline with adaptive scope (adaptability 40→41 stable)
55348b6	8.286274	discard	s=44,c=41,a=40,e=42,n=40,d=40,t=43,g=41.7	replace trade-offs with artifact naming (clarity -1, example -1, no actionability gain)
1e0fbce	8.262745	discard	s=44,c=41,a=40,e=42.3,n=38.7,d=39.3,t=43,g=41.7	add tool names to example (clarity -1, conciseness -2.3, adaptability -2)
b50ce2c	8.305882	discard	s=44,c=41,a=40,e=42.7,n=38,d=40.3,t=43,g=42	replace trade-offs with checkpoint (conciseness -3)
9a48926	8.266667	discard	s=44,c=41.3,a=40,e=41.7,n=40,d=39,t=43,g=41.7	link protocol to verify command (adaptability -2, example -1.3)
ffc80f6	8.411765	keep	s=44,c=42,a=41,e=43,n=40,d=41,t=43,g=42	replace stages-small with risk isolation (actionability 40→41, conciseness 41→40, net +1.0w)
64b7b3b	8.345098	discard	s=44,c=41.3,a=40,e=43,n=40.7,d=40.3,t=43,g=42	remove 2 redundant guidelines (actionability -1, no conciseness gain)
b6c8b16	8.286274	discard	s=44,c=41,a=40,e=42,n=40,d=40,t=43,g=41.7	replace ground-decisions with design-for-deletion (clarity -1, example -1, actionability -1)
a5e61c8	8.262745	discard	s=44,c=41.7,a=40,e=41.3,n=38.7,d=39.3,t=43,g=41.7	replace flag-trade-offs with capability-per-stage (example -1.7, conciseness -1.3)
7e55b78	8.250980	discard	s=44,c=41.7,a=40,e=41.3,n=40.3,d=38,t=43,g=41.7	add external deps to large triage (adaptability -3!)
670900c	8.513725	keep	s=45,c=43,a=41,e=43.3,n=41.7,d=40.3,t=43.7,g=42.7	enrich validate with criteria-to-task mapping (s+1, c+1, n+1.7, t+0.7, g+0.7)
eb959cf	8.403922	discard	s=44.3,c=42,a=40.3,e=43,n=40.7,d=40.3,t=43.3,g=42.3	counterfactual triage in example (score regressed, conciseness hurt)
147da00	8.462745	discard	s=44.3,c=42.3,a=41,e=43.3,n=40,d=41.3,t=43.3,g=42.3	add risk-first to example stages (introduced variance, avg lower)
3005b0d	8.564706	keep	s=45,c=43,a=41,e=44,n=41.3,d=41.3,t=44,g=43	phase roadmap in description (stabilized all dims, avg +0.05)
2db4441	8.611765	keep	s=45,c=43,a=42,e=44,n=41,d=42,t=44,g=43	add output filename to example PRD (actionability +1, adaptability +1, conciseness -1)
54d65bd	8.564706	discard	s=45,c=43,a=41.7,e=44,n=40.7,d=40.7,t=44,g=43	tighten wordy passages (shorter hurt clarity, score -0.047)
31dc03d	8.513725	discard	s=44.7,c=42.7,a=41,e=43.7,n=40.7,d=41.3,t=43.7,g=42.7	add integration points to example (high variance, run1 crashed to 8.36)
